{
  "segment": 10,
  "distance": [
    0.0,
    0.2,
    0.41,
    0.61,
    0.81,
    1.02,
    1.22,
    1.42,
    1.63,
    1.83,
    2.03,
    2.23,
    2.44,
    2.64,
    2.84,
    3.1,
    3.3,
    3.5,
    3.71,
    3.91,
    4.11,
    4.32,
    4.52,
    4.72,
    4.93,
    5.13,
    5.33,
    5.54,
    5.74,
    5.99
  ],
  "elevation": [
    306.0,
    288.6,
    276.0,
    264.0,
    253.5,
    248.0,
    234.0,
    220.2,
    208.3,
    203.3,
    209.0,
    210.0,
    212.0,
    216.0,
    214.0,
    217.8,
    221.0,
    218.0,
    217.0,
    221.0,
    219.0,
    218.8,
    216.7,
    219.0,
    214.0,
    216.1,
    219.0,
    220.1,
    229.0,
    229.0
  ],
  "gradient": [
    0.0,
    -4.8,
    -7.5,
    -5.7,
    -6.5,
    0.0,
    -11.0,
    -4.7,
    -7.8,
    0.5,
    2.0,
    -2.0,
    2.8,
    0.0,
    -2.0,
    3.5,
    0.0,
    -2.0,
    1.7,
    0.0,
    0.0,
    -0.4,
    1.3,
    -2.0,
    0.0,
    0.9,
    0.0,
    2.1,
    3.3,
    -5.9
  ],
  "power_30kmh": [
    156,
    0,
    0,
    0,
    0,
    156,
    0,
    0,
    0,
    188,
    283,
    28,
    334,
    156,
    28,
    379,
    156,
    28,
    264,
    156,
    156,
    130,
    239,
    28,
    156,
    213,
    156,
    290,
    366,
    0
  ],
  "power_35kmh": [
    234,
    0,
    0,
    0,
    0,
    234,
    0,
    0,
    0,
    271,
    383,
    85,
    442,
    234,
    85,
    495,
    234,
    85,
    361,
    234,
    234,
    204,
    331,
    85,
    234,
    301,
    234,
    390,
    480,
    0
  ],
  "power_40kmh": [
    337,
    0,
    0,
    0,
    0,
    337,
    0,
    0,
    0,
    379,
    507,
    167,
    575,
    337,
    167,
    634,
    337,
    167,
    481,
    337,
    337,
    303,
    447,
    167,
    337,
    413,
    337,
    515,
    617,
    0
  ],
  "power_50kmh": [
    627,
    117,
    0,
    22,
    0,
    627,
    0,
    128,
    0,
    681,
    840,
    415,
    925,
    627,
    415,
    999,
    627,
    415,
    808,
    627,
    627,
    585,
    766,
    415,
    627,
    723,
    627,
    851,
    978,
    0
  ],
  "summary": {
    "avg_gradient": -1.3,
    "max_gradient": 7.7,
    "avg_climb_gradient": 2.6,
    "avg_descent_gradient": -4.6,
    "max_climb_gradient": 7.7,
    "max_descent_gradient": -13.6,
    "elevation_gain": 51,
    "elevation_loss": 128,
    "avg_power_30kmh": 135,
    "avg_power_35kmh": 196,
    "avg_power_40kmh": 274,
    "avg_power_50kmh": 503,
    "estimated_time_30kmh": "11:59",
    "estimated_time_35kmh": "10:16",
    "estimated_time_40kmh": "8:59",
    "estimated_time_50kmh": "7:11",
    "time_unit": "min:sec"
  }
}